topicId,words..
1,half pound sugar salt two put take hot fine boil
2,two until set mix eggs turn serve yolks fried milk
3,water lemon sauce stew cups stir two little potatoes cut
4,take let little pound cake eggs milk water pint cut
5,water use soup beef pork inch boiling pan cream minutes
6,cold brown until heat large fat side roast soft clean
7,pan add half warm two thin cream dish same sauce
8,cupful salt egg half water sugar hot butter small custard
9,two table half minutes cupful put add cream butter sauce
10,three hot milk place minutes sugar stir white dish done
11,put well tablespoonful pepper flour teaspoonful take light beat add
12,fish sauce egg small cut used fat mix saltspoonful keep
13,two flour add cupful three egg soda milk hot salt
14,water put until served hot pepper each boiled fried good
15,half sugar water eggs milk little tablespoonfuls beat well boiling
16,salt cut fire made large hot dish serve cool sauce
17,put minutes cook roll three salt keep enough apple water
18,meat till teaspoonful milk butter tablespoonful sugar bread made cake
19,cold hot small table fruit each enough stir quart made
20,water salt boiled boiling paste fine hot rice taste beaten
21,butter half cover put boil two four together brown sugar
22,cream add cake water until nice adding whites cold teaspoonful
23,add flour eggs boil three sugar egg bread two white
24,cream hot add flour salt crumbs food white other cakes
25,cups cake molasses teaspoonful place fruit baking soft yolks used
