topicId,words..
1,teaspoon add salt tablespoons let juice place serve hot minutes
2,two half women good seattle three cups suffrage pound well
3,water put salt mix stir let hours add little yolks
4,until see cut tea add butter ice well much cooked
5,water boiled salt meat fish dish rice cold cooked flour
6,half two three minutes mixture made beat boiling cook use
7,onion chopped once soup bread little small add two dry
8,boil pepper add flour salt chicken pound cream vinegar tomatoes
9,sugar angeles eggs street boil miss fine take well oranges
10,sugar water until flour cups cut well milk chopped whites
11,milk cream used salt remove same butter foods water food
12,add ounces pound serve cut chopped stock parsley england cook
13,food lemon coffee yolk jelly beef strain feeding season amount
14,until sauce salad cook drain add potatoes butter serve white
15,water egg sugar tablespoon value grains few small boiling white
16,put cupful well take fire delicious set minutes piece fine
17,teaspoonful tablespoonfuls tablespoonful cold butter fire pint five dish hot
18,let little mettez two small ajoutez good eau three cuiller
19,water put add pint boiling saltspoonful stand minutes each until
20,two half three four add until butter cal cups flour
21,sugar butter eggs well pint make water till hot add
22,tablespoon cream teaspoon cold tablespoons bread baking large pan small
23,butter lemon eggs minutes egg page hot yolks cold fine
24,cut put serve half pan take sugar hour stir good
25,chocolate sugar lb water until add stir milk vanilla cream
