topicId,words..
1,fine flour take hot dry quarter orange done hour same
2,little eggs parsley white thick pieces mushrooms same till lobster
3,sauce salt pepper serve boiled sugar roast vinegar lemon crumbs
4,eggs rose amp bake melted pounds beef well gill five
5,dish two white clean bread pan parsley yolks make fish
6,meat flavour egg fat fry vegetables done three puddings dressed
7,cold brown mutton boiling juice enough quarts mixed glass fresh
8,pint cover vinegar winter old dried roll called currant pots
9,proportions five glassful entree indicated boil lbs warm hours soup
10,put butter make half good wine pint nutmeg well sweet
11,water tablespoonful cream suit well chopped put ready roast each
12,water put till three six large four close few eggs
13,boil butter milk best bake hours well ounce fish rub
14,take boil cut gravy little small sauce together fry garnish
15,two ounces half mix part good set pounds like preserve
16,cut way sugar day cream cold tea dry choose long
17,add cover cheese rice paper powder quite peel taken first
18,little beef liquor meat cream eggs fire pudding wash spoonful
19,pound sugar half add hour salt quart fire cold use
20,sauce butter tablespoonsful preparation let time add persons lb pan
21,keep another simmer well bit much large ways spoonful colour
22,let lay pie thick keep tender onion boiling cloves steaks
23,small jelly gravy excellent quantity pan thin paste fruit boiled
24,made beaten bottom great end remove mortar others keeping bread
25,put four each soup give ready five broth ham strain
